{
  "version": 1,
  "workflow": {
    "components": [
      {"id": "loop-fixture.correct", "path": "correct.clj", "dependencies": ["kernel"]},
      {"library": "kernel"}
    ],
    "entry": "loop-fixture.correct/run"
  },
  "missions": {},
  "input": {"value": {}},
  "limits": {"run_duration_ms": 30000, "subordinate_evaluations": 1}
}
