{
  "input": {
    "value": {}
  },
  "limits": {
    "subordinate_evaluations": 128
  },
  "missions": {
    "candidate-0": {
      "components": [
        {
          "id": "lab.intervals",
          "path": "candidate-0.clj"
        }
      ]
    },
    "candidate-1": {
      "components": [
        {
          "id": "lab.intervals",
          "path": "candidate-1.clj"
        }
      ]
    },
    "candidate-2": {
      "components": [
        {
          "id": "lab.intervals",
          "path": "candidate-2.clj"
        }
      ]
    },
    "candidate-3": {
      "components": [
        {
          "id": "lab.intervals",
          "path": "candidate-3.clj"
        }
      ]
    }
  },
  "providers": {
    "mission": [],
    "workflow": []
  },
  "version": 1,
  "workflow": {
    "components": [
      {
        "dependencies": [
          "kernel"
        ],
        "id": "lab.check",
        "path": "check.clj"
      },
      {
        "library": "kernel"
      }
    ],
    "entry": "lab.check/run"
  }
}