{
  "version": 1,
  "workflow": {
    "components": [
      {"id": "triage.workflow", "path": "workflow.clj", "dependencies": ["agent.core"]},
      {"library": "agent.core"}
    ],
    "entry": "triage.workflow/run"
  },
  "input": {
    "value": {
      "task": "List the tickets that breached their SLA, highest priority first, using the triage.rules functions. Return a vector of maps, each with the ticket's id and priority."
    }
  },
  "missions": {
    "default": {
      "components": [
        {"id": "triage.rules", "path": "triage.clj"}
      ],
      "data": {
        "tickets": [
          {"id": "T-1001", "subject": "Refund for duplicate charge", "body": "Charged twice for the March invoice, please refund one.", "channel": "email", "tier": "pro", "minutes_open": 300},
          {"id": "T-1002", "subject": "Dashboard is down", "body": "Our whole team gets a 502 on the dashboard since this morning.", "channel": "chat", "tier": "pro", "minutes_open": 45},
          {"id": "T-1003", "subject": "How do I export CSV?", "body": "Looking for the export button described in the docs.", "channel": "email", "tier": "free", "minutes_open": 200},
          {"id": "T-1004", "subject": "Refund policy question", "body": "Considering a downgrade; does the refund cover unused months?", "channel": "email", "tier": "free", "minutes_open": 700},
          {"id": "T-1005", "subject": "API returns 500 on upload", "body": "Uploads over 10 MB fail with a 500 since yesterday.", "channel": "chat", "tier": "pro", "minutes_open": 130},
          {"id": "T-1006", "subject": "Password reset loop", "body": "Reset email link keeps sending me back to the login page.", "channel": "email", "tier": "free", "minutes_open": 500}
        ]
      }
    }
  },
  "providers": {
    "workflow": [{"name": "deepseek"}]
  },
  "limits": {
    "evaluation_timeout_ms": 15000
  },
  "labels": {
    "name": "support-triage-domain-api",
    "model": "openrouter:deepseek/deepseek-v4-flash",
    "provider": "openrouter",
    "tags": {"mode": "agent"}
  }
}
