{
  "$schema": "https://ptc-runner.dev/schemas/ptc-application-manifest.schema.json",
  "version": 1,
  "workflow": {
    "components": [
      {"id": "tutorial.orders", "path": "orders.clj"}
    ],
    "entry": "tutorial.orders/summarize"
  },
  "input": {"path": "orders.json"},
  "contracts": {
    "input_schema": {"path": "input.schema.json"},
    "result_schema": {"path": "result.schema.json"}
  }
}
