{
  "input": {
    "value": {}
  },
  "limits": {
    "subordinate_evaluations": 128
  },
  "missions": {},
  "providers": {
    "mission": [],
    "workflow": []
  },
  "version": 1,
  "workflow": {
    "components": [
      {
        "dependencies": [
          "kernel"
        ],
        "id": "lab.check",
        "path": "check.clj"
      },
      {
        "library": "kernel"
      }
    ],
    "entry": "lab.check/run"
  }
}